{
  "issue": "8",
  "role": "adversarial-reviewer",
  "agent_tool": "Codex",
  "session_label": "issue-8-adversarial-review",
  "base_sha": "55011c9",
  "branch": "codex/agentic-harness",
  "started_at": "2026-07-05T04:52:00Z",
  "ended_at": "2026-07-05T04:53:00Z",
  "allowed_paths": [],
  "commands_run": [
    {
      "command": "python -m pytest --doctest-modules dphtools tests",
      "exit_code": 0,
      "summary": "Full doctest command passed."
    }
  ],
  "artifacts": [
    "docs/exec-plans/active/8-adversarial-review.md"
  ],
  "result": "passed",
  "notes": "No blocking findings."
}
