{
  "issue": "5",
  "role": "adversarial-reviewer",
  "agent_tool": "Codex",
  "session_label": "issue-5-adversarial-review",
  "base_sha": "53ef2e8",
  "branch": "codex/agentic-harness",
  "started_at": "2026-07-05T04:22:00Z",
  "ended_at": "2026-07-05T04:23:00Z",
  "allowed_paths": [],
  "commands_run": [
    {
      "command": "python -m pytest -q tests/test_utils.py::test_split_img tests/test_utils.py::test_split_img_random",
      "exit_code": 0,
      "summary": "Focused tests passed after the implementation."
    },
    {
      "command": "python -m pytest -q tests",
      "exit_code": 0,
      "summary": "Full suite passed after the implementation."
    }
  ],
  "artifacts": [
    "docs/exec-plans/active/5-adversarial-review.md"
  ],
  "result": "passed",
  "notes": "No blocking findings for the narrow compatibility fix."
}
