{
  "issue": "8",
  "role": "implementer",
  "agent_tool": "Codex",
  "session_label": "issue-8-implementation",
  "base_sha": "55011c9",
  "branch": "codex/agentic-harness",
  "started_at": "2026-07-05T04:49:00Z",
  "ended_at": "2026-07-05T04:51:00Z",
  "allowed_paths": [
    "dphtools/utils/__init__.py"
  ],
  "commands_run": [
    {
      "command": "python -m pytest --doctest-modules dphtools tests",
      "exit_code": 0,
      "summary": "Full doctest command passed after scalar normalization."
    }
  ],
  "artifacts": [],
  "result": "passed",
  "notes": "Changed scalar outputs without editing tests or numerical tolerances."
}
