{
  "issue": "5",
  "role": "numerics-reviewer",
  "agent_tool": "Codex",
  "session_label": "issue-5-numerics-review",
  "base_sha": "53ef2e8",
  "branch": "codex/agentic-harness",
  "started_at": "2026-07-05T04:24:00Z",
  "ended_at": "2026-07-05T04:25:00Z",
  "allowed_paths": [],
  "commands_run": [
    {
      "command": "python -m pytest -q tests/test_utils.py::test_split_img tests/test_utils.py::test_split_img_random",
      "exit_code": 0,
      "summary": "Focused tests passed after replacing the removed alias."
    }
  ],
  "artifacts": [
    "docs/exec-plans/active/5-numerics-review.md"
  ],
  "result": "passed",
  "notes": "No tolerance or scientific model changes."
}
