{
  "issue": "6",
  "role": "release-guard",
  "agent_tool": "Codex",
  "session_label": "issue-6-release-guard",
  "base_sha": "55011c9",
  "branch": "codex/agentic-harness",
  "started_at": "2026-07-05T04:43:00Z",
  "ended_at": "2026-07-05T04:44:00Z",
  "allowed_paths": [
    "docs/exec-plans/active/6-release-guard.md",
    "docs/agent-harness/runs/6/2026-07-05T044300Z-release-guard.json"
  ],
  "commands_run": [
    {
      "command": "make package",
      "exit_code": 0,
      "summary": "Package build and twine check passed before PR creation."
    },
    {
      "command": "gh api repos/david-hoffman/dphtools/environments/pypi",
      "exit_code": 0,
      "summary": "Protected release environment exists and requires reviewer approval."
    }
  ],
  "artifacts": [
    "docs/exec-plans/active/6-release-guard.md",
    "docs/generated/phase4-release-downstream-hardening.md"
  ],
  "result": "passed",
  "notes": "No publishing command was run."
}
