{
  "issue": "6",
  "role": "adversarial-reviewer",
  "agent_tool": "Codex",
  "session_label": "issue-6-harness-adversarial-review",
  "base_sha": "55011c9",
  "branch": "codex/agentic-harness",
  "started_at": "2026-07-05T04:45:00Z",
  "ended_at": "2026-07-05T04:46:00Z",
  "allowed_paths": [],
  "commands_run": [
    {
      "command": "make check",
      "exit_code": 0,
      "summary": "Full local gate passed before PR creation."
    }
  ],
  "artifacts": [
    "docs/exec-plans/active/6-adversarial-review.md"
  ],
  "result": "passed",
  "notes": "No blocking findings for harness rollout after CI-triage changes."
}
