{
  "issue": "6",
  "role": "scout",
  "agent_tool": "Codex",
  "session_label": "issue-6-harness-scout",
  "base_sha": "55011c9",
  "branch": "codex/agentic-harness",
  "started_at": "2026-07-05T04:34:00Z",
  "ended_at": "2026-07-05T04:35:00Z",
  "allowed_paths": [],
  "commands_run": [
    {
      "command": "gh pr checks 7",
      "exit_code": 1,
      "summary": "Identified failing harness validation and OS matrix doctest checks."
    }
  ],
  "artifacts": [
    "docs/exec-plans/active/6-scout.md"
  ],
  "result": "passed",
  "notes": "Read-only scope classification for high-risk harness rollout."
}
