{
  "issue": "5",
  "role": "implementer",
  "agent_tool": "Codex",
  "session_label": "issue-5-implementation",
  "base_sha": "53ef2e8",
  "branch": "codex/agentic-harness",
  "started_at": "2026-07-05T04:19:00Z",
  "ended_at": "2026-07-05T04:21:00Z",
  "allowed_paths": [
    "dphtools/utils/__init__.py"
  ],
  "commands_run": [
    {
      "command": "python -m pytest -q tests/test_utils.py::test_split_img tests/test_utils.py::test_split_img_random",
      "exit_code": 0,
      "summary": "12 focused split_img tests passed."
    },
    {
      "command": "python -m pytest -q tests",
      "exit_code": 0,
      "summary": "35 tests passed with 3 warnings."
    }
  ],
  "artifacts": [],
  "result": "passed",
  "notes": "Changed np.product to np.prod without editing tests."
}
