{
  "issue": "6",
  "role": "ci-triager",
  "agent_tool": "Codex",
  "session_label": "issue-6-ci-triage",
  "base_sha": "55011c9",
  "branch": "codex/agentic-harness",
  "started_at": "2026-07-05T04:36:00Z",
  "ended_at": "2026-07-05T04:42:00Z",
  "allowed_paths": [
    "scripts/agent_harness/validate_pr.py",
    "docs/exec-plans/active/6-ci-triage.md",
    "docs/agent-harness/runs/6/2026-07-05T043600Z-ci-triager.json"
  ],
  "commands_run": [
    {
      "command": "gh run view 28729460656 --job 85192521294 --log-failed",
      "exit_code": 0,
      "summary": "Harness validation failed on missing labels and over-broad metadata requirements."
    },
    {
      "command": "gh run view 28729460656 --job 85192521299 --log-failed",
      "exit_code": 0,
      "summary": "Ubuntu doctests failed with NumPy scalar repr output."
    }
  ],
  "artifacts": [
    "docs/exec-plans/active/6-ci-triage.md"
  ],
  "result": "passed",
  "notes": "CI validation changes are scoped to metadata freshness and role-evidence boundaries."
}
